{
  "schema_version": "1.0",
  "record_kind": "example",
  "pass_id": "pass_003",
  "action_id": "step_02",
  "action_revision": 1,
  "created_at": "2026-10-20T00:30:00Z",
  "goal_ref": "protected/goal.md",
  "previous_pass_id": "pass_002",
  "objective": "Repair whitespace-only title validation and repeat all CLI checks within step_02.",
  "starting_state": {
    "confirmed_facts": [
      "Example pass_002 left a CLI that incorrectly accepts a whitespace-only title.",
      "No task data exists in this scenario."
    ],
    "assumptions": [
      "All state statements describe the synthetic scenario only."
    ],
    "unknowns": []
  },
  "sources": [
    {
      "id": "goal",
      "location": "protected/goal.md",
      "version": "package-goal-v1"
    },
    {
      "id": "scenario",
      "location": "examples/four_pass_walkthrough/README.md",
      "version": "example-v1"
    }
  ],
  "parties": [
    {
      "id": "ai_assistant",
      "name": "AI assistant",
      "role": "Implement a small standard-library Python entry point with add, list, and complete subcommands and argument validation.",
      "authority": [
        "Inspect relevant resources and perform this action only within recorded authorization.",
        "Record evidence and update progress; do not change protected requirements."
      ],
      "expected_outcomes": [
        {
          "id": "step_02-AI-01",
          "condition": "The help text and command parsing work; blank titles and invalid integer IDs are rejected; unfinished commands do not falsely report success.",
          "verification": "Review the action checks, resulting deliverables, and recorded evidence."
        }
      ]
    },
    {
      "id": "human_owner",
      "name": "Human owner",
      "role": "Define or authorize the action scope and resolve decisions that exceed the assistant authority.",
      "authority": [
        "Approve or change project scope and protected instructions."
      ],
      "expected_outcomes": [
        {
          "id": "step_02-HUMAN-01",
          "condition": "An actual human instruction authorizes this action scope.",
          "verification": "Reference the recorded instruction and check that its scope covers this action."
        }
      ]
    }
  ],
  "resources": [
    {
      "id": "ec2_server",
      "description": "Imagined EC2 execution environment; not an actual connection.",
      "location": "/home/ubuntu/task-tracker (synthetic)"
    },
    {
      "id": "project_directory",
      "description": "Imagined application directory.",
      "location": "/home/ubuntu/task-tracker (synthetic)"
    }
  ],
  "scope": {
    "included": [
      "Create the command-line interface.",
      "Required checks and in-scope fixes for this action."
    ],
    "excluded": [
      "Unrelated changes.",
      "System package changes without additional authorization.",
      "Editing protected requirements as part of routine execution."
    ]
  },
  "constraints": [
    "Example only; do not execute these records.",
    "Use standard-library application code and isolated test data."
  ],
  "authorization": {
    "status": "granted",
    "reference": "examples/four_pass_walkthrough/README.md#read-one-pass",
    "basis": "Synthetic authorization for the walkthrough only; not a real user approval.",
    "scope": [
      "Example steps 01–03 and up to three in-scope passes per revision."
    ]
  },
  "deliverables": [
    {
      "id": "step_02-D-01",
      "description": "The help text and command parsing work; blank titles and invalid integer IDs are rejected; unfinished commands do not falsely report success.",
      "location": "/home/ubuntu/task-tracker/task_tracker.py (synthetic)",
      "format": "Illustrative Python source and evidence"
    }
  ],
  "acceptance_criteria": [
    {
      "id": "step_02-AC-01",
      "condition": "Help lists add, list, and complete.",
      "verification": "Help lists add, list, and complete."
    },
    {
      "id": "step_02-AC-02",
      "condition": "A whitespace-only title is rejected.",
      "verification": "A whitespace-only title is rejected."
    },
    {
      "id": "step_02-AC-03",
      "condition": "A non-integer or nonpositive task ID is rejected.",
      "verification": "A non-integer or nonpositive task ID is rejected."
    },
    {
      "id": "step_02-AC-04",
      "condition": "Unknown commands fail clearly.",
      "verification": "Unknown commands fail clearly."
    }
  ],
  "execution_plan": [
    {
      "sequence": 1,
      "party_id": "ai_assistant",
      "operation": "Repair whitespace-only title validation and repeat all CLI checks within step_02.",
      "expected_result": "The help text and command parsing work; blank titles and invalid integer IDs are rejected; unfinished commands do not falsely report success."
    },
    {
      "sequence": 2,
      "party_id": "ai_assistant",
      "operation": "Run the listed checks and record results.",
      "expected_result": "Every required criterion has supporting evidence or an explicit not-checked result."
    }
  ],
  "recovery": {
    "max_passes_per_revision": 3,
    "stop_condition": "Stop earlier after a repeated unchanged failure with no new evidence or corrective change.",
    "missing_information": "Stop the affected work and report the missing information.",
    "failure_handling": "Inspect partial effects; preserve the failure; use a new pass for a justified in-scope repair."
  }
}
